{
  "schema_version": "1.0.0",
  "engagement_kind": "prime_and_subs",
  "party": {
    "name": "Acme Defense LLC",
    "uei": "ABCDEFGHIJ12",
    "cage": "1A2B3"
  },
  "on_prem_ot": "no",
  "interview_facts": [
    {
      "question_id": "iam-001",
      "question_text": "Does your organization enforce multi-factor authentication (MFA) for all users accessing CUI systems?",
      "answer": "yes",
      "provenance": "operator_interview",
      "confidence": "high",
      "recorded_at": "2026-07-05T10:00:00Z"
    }
  ],
  "posture_summary": {
    "conservative_score": 25,
    "control_status_summary": {
      "level": "L2",
      "met": 1,
      "partial": 0,
      "not_met": 3,
      "unknown": 0
    }
  },
  "timing_segments": [
    {
      "segment": "setup",
      "started_at": "2026-07-05T09:00:00Z",
      "stopped_at": "2026-07-05T09:15:00Z",
      "duration_ms": 900000
    }
  ]
}
